{
  "schema_version": 1,
  "contract_version": 1,
  "operator_id": "equant.ttr.sma",
  "operator_version": "1.0.0",
  "semantic_name": "SMA",
  "distribution": "equant-ttr",
  "module": "ettr",
  "callable": "sma",
  "execution_scope": "time_series",
  "lifecycle": "stateless",
  "causality": "past_only",
  "availability": "close_t",
  "mutates_input": false,
  "availability_depends_on_input": false,
  "input": {
    "required_columns": ["close"],
    "optional_columns": [],
    "supported_dtypes": ["float64"],
    "minimum_assets": 1,
    "minimum_time_length": 1,
    "requires_complete_cross_section": false,
    "requires_benchmark": false,
    "requires_industry_data": false,
    "requires_market_cap_data": false,
    "requires_fundamental_data": false,
    "requires_sorted_input": false,
    "required_context": ["timezone", "calendar", "frequency", "timestamp_semantics", "currency", "price_adjustment", "data_version", "source"]
  },
  "parameters": {
    "window": {
      "type": "integer",
      "default": 20,
      "required": false,
      "constraints": { "minimum": 1 },
      "unit": "sessions",
      "affects_warmup": true,
      "affects_output_fields": true,
      "affects_causality": false,
      "affects_availability": false
    }
  },
  "output": {
    "fields": [
      { "name_template": "sma_{window}", "dtype": "float64", "value_range": "finite_or_nan" }
    ],
    "alignment": "canonical_order",
    "warmup": "window - 1",
    "nan_policy": "propagate",
    "multiple_outputs": false
  },
  "determinism": {
    "bitwise_deterministic": true,
    "random_seed_required": false,
    "tolerance": { "absolute": 0, "relative": 0 },
    "tested_platforms": ["macos-arm64-python3.12"]
  },
  "implementation": {
    "package_version": "1.0.0",
    "source_commit": "git-sha1:0123456789abcdef0123456789abcdef01234567",
    "source_files": ["examples/valid/provider-source/ettr.py"],
    "source_tree_digest": "sha256:ef3604168a06b136282e297c62a40aa340352c711a475e88ee2def218d4f854e",
    "implementation_digest": "sha256:97b9dc8fbbdad66716caf7d3d1bf74d7179f7c2f8c83e60cf1fb1790a79f1d7a",
    "build_identifier": "equant-ttr-1.0.0"
  }
}
